{
  "schemaVersion": "BehaviorRelationalFeatureV1",
  "contractId": "RC6-M2-BEHAVIOR-RELATIONAL-FEATURE-V1-REV4-2026-08-15",
  "revision": 4,
  "status": "FROZEN",
  "encoding": "UTF-8",
  "title": "Source机械投影到固定五项生产即时关系特征",
  "authority": {
    "productionChain": "Source_MECHANICAL_PROJECTION -> Compiler_FIXED_FIVE_FEATURES",
    "productionInputTrustBoundary": "生产只允许 Source -> Compiler；Compiler 裸入口仅用于测试，不是外部信任边界。Source production entry 只信任当前加载的正式 Decision/Preview/PDA API 对象 identity；任意替换、proxy 或 test-double API 必须拒绝。候选 PDA/Preview rows 在该正式 API 信任边界内视为 authenticated mechanical evidence，不把恶意替换 API 当作生产威胁。",
    "inputTopLevelExactFields": [
      "schemaVersion",
      "frozenCandidateIds",
      "baselineEntries",
      "candidateEntriesById",
      "publicConsumers",
      "baselineCompletenessByAxis",
      "candidateCompletenessByAxis",
      "actionCatalogCompleteness",
      "sourceClosure",
      "registryAttestation"
    ],
    "publicOnly": true,
    "selection": false,
    "scoring": false,
    "probabilityWeighting": false,
    "candidateVsCandidate": false,
    "futureTraversal": false,
    "teacherReasoning": false
  },
  "inputShape": {
    "baselineEntryKinds": ["TEAM_EFFECT"],
    "candidateEntryKinds": ["TEAM_EFFECT", "RESOURCE_SUPPLY", "FOLLOW_UP"],
    "publicConsumerExactFields": [
      "consumerId",
      "ownerId",
      "resourceKey",
      "currentAmount",
      "requiredAmount",
      "actionId",
      "followUpKeys",
      "sourceFactIds",
      "sourceEventIds"
    ],
    "baselineCompletenessFields": ["TEAM_EFFECT"],
    "candidateCompletenessFields": ["TEAM_EFFECT", "RESOURCE_SUPPLY", "FOLLOW_UP"],
    "completenessValues": ["COMPLETE", "PARTIAL"],
    "actionCatalogCompletenessValues": ["COMPLETE", "PARTIAL"]
  },
  "entryRules": {
    "sourceRefs": "sourceFactIds 与 sourceEventIds 必须同时存在且各自唯一；至少一个数组非空；所有 ID 必须在 sourceClosure 中闭合。允许使用同一事务中实际存在的 requestHash、opportunityId、visibleWorldRevision、scheduleRevision，以及已验证的 PDA sourceEffectId、Preview semanticKey/effectInstanceId/rootCauseId、声明 actionId 作为真实 refs；candidate 与 baseline 的 sourceFactIds/sourceEventIds 默认必须互不相交，且与 publicConsumer source refs 的交集也禁止；FOLLOW_UP grantProofIds 是 grant 自有的 authenticated evidence，V1 只接受真实 PDA/Preview grant row/event 的 entryId；每个 proof 必须出现在该 grant 自己的 sourceFactIds 或 sourceEventIds 中并在 sourceClosure 中闭合。grantProofIds 可以且必须与当前 grant row 的 own refs 对齐，不要求、也不得伪装成 consumer proof；Compiler 只验证 proof 的 authenticated grant 来源、closure 和 own-ref 包含关系，不验证 proof 属于 consumer；publicConsumer declaration fingerprint 仅可作为 actionId/consumerId，禁止进入 sourceFactIds/sourceEventIds；catalog evidence refs 必须绑定实际 requestHash、visibleWorldRevision 与真实 catalog scan boundary；无实际 actionId 时禁止生成 public-action 伪 event；不得为合同另造 ref ID。",
    "TEAM_EFFECT": {
      "fields": ["capabilityKind", "ownerId", "targetId", "effectAxis", "effectKey", "timeBand", "durationBand", "sourceFactIds", "sourceEventIds"],
      "identity": "JSON.stringify([targetId,effectAxis,effectKey,timeBand])；durationBand 不进入 identity。只有 sourceEffectId -> prototypeKind -> 固定 registry 映射完整闭合后才可投影；sourceActorId -> ownerId；PDA targetIds 必须是具体已验证目标，按每个 targetId 确定性 fan-out，不通过名称、技能名或显示文本补目标。",
      "effectKey": "必须等于 JSON.stringify([事实factType,key,unit,direction])；direction 仅对有限有符号 numeric amount 推导：amount>0=POSITIVE，amount<0=NEGATIVE，amount=0=NEUTRAL。PDA 标记 PENDING_DIRECTION_PROJECTION、非有限或缺失 amount 时，该候选 TEAM_EFFECT 轴必须为 PARTIAL；本合同不定义 BOOL direction，BOOL 没有上游显式 direction 时同样必须 PARTIAL；factType 只是 effectKey 操作数，不单独决定 capabilityKind；不得读取角色名、技能名、显示文本或中文理由。",
      "timeBand": "direct fact=NOW；scheduled fact=SCHEDULED。",
      "durationBand": "仅接受有限非负整数 durationTurns：0=INSTANT，1=SHORT，2-3=MEDIUM，>=4=LONG；PERSISTENT 只接受显式 no-expiry typed fact；缺失 durationTurns 不能当 INSTANT，非闭合或 deferred duration 使候选 TEAM_EFFECT 轴 PARTIAL。"
    },
    "RESOURCE_SUPPLY": {
      "fields": ["capabilityKind", "ownerId", "targetId", "resourceKey", "timeBand", "supplyAmount", "publicMaxAmount", "sourceFactIds", "sourceEventIds"],
      "amount": "只接受 Preview component=RESOURCE_OPTION 的 effect 行（正式 outcomeKind=RESOURCE_OPTION_CHANGED），排除 ACTION_COST；targetId 必须明确；applicationProbability 与 ownApplicationProbability 必须精确为 1；current/next 必须有限；resourceKey 必须来自 Preview 正式 resourceKey，或通过冻结正式表将 Preview evidence.resource 的四个正式标签 生命/体力/魂力/精神力分别映射为 hp/vit/sp/men；该表是正式语义映射而非兼容 alias；未知标签使该候选 RESOURCE_SUPPLY 轴 PARTIAL；publicMaxAmount 的权威值来自同一 targetId 的公开 visible unit max，Preview evidence 不要求含 max；supplyAmount=max(0,next-current)，0 可用于证明 cap 命中。",
      "targetClosure": "每个 targetId 必须有同 targetId 的 Preview before/after 证据，publicMaxAmount 另由该 target 的公开 visible unit max 闭合；PDA sourceEffectId、Preview effectInstanceId 与 target 集合必须闭合到该 effect 行；expectedDelta、PDA declared amount、概率加权 next 均不得作为供给；相同 targetId/resourceKey/timeBand 的多 effect 供给必须按 supplyAmount 数值累加并合并 source refs，不能用身份去重丢金额；缺少逐目标证据时该候选 RESOURCE_SUPPLY 轴为 PARTIAL。",
      "currentAxis": "当前公开 deficit 与 consumer 只接受 timeBand=NOW 的 supply；SCHEDULED supply 不改变当前可支付性。"
    },
    "FOLLOW_UP": {
      "fields": ["capabilityKind", "grantType", "ownerId", "followUpKey", "grantProofIds", "sourceFactIds", "sourceEventIds"],
      "rule": "只接受显式 grantType=FOLLOW_UP。grantProofIds 必须非空；V1 每个 proof 必须是正式 PDA/Preview authenticated grant row/event 的真实 entryId，出现在该 grant 自己的 sourceFactIds 或 sourceEventIds 中，并在 sourceClosure 中闭合。Source/Compiler 不得把 proof 当作 consumer proof，不要求 proof 出现在 publicConsumer refs，也不得验证 proof 属于 consumer；consumer 绑定独立按 grant.ownerId===consumer.ownerId 且 consumer.followUpKeys 包含 grant.followUpKey。Source 必须先验证 grant row/event 的 authenticated identity、ownerId、followUpKey 和 own refs，再索引当前 grant row；proof 可以且必须与当前 grant row own refs 对齐。followUpKeys=[] 仅在 Source 完整 prototype/grant scan 证明无机制授予且无 pending/deferred 时成立；unknown prototype 或 prototype/grant scan 不完整均使 action catalog/FOLLOW_UP 轴为 PARTIAL，显式 followUpKeys=[] 不能覆盖该结论；缺失或非法 followUpKeys 不得静默归空，否则 action catalog/FOLLOW_UP 轴必须为 PARTIAL；机制授予本身默认 NOT_RELATIONAL，不能按原型名推断 FOLLOW_UP。"
    },
    "publicConsumer": "只记录当前公开 snapshot 与当前公开 action cost；不遍历未来路线。正式 actionId 存在时 publicConsumer.actionId 与 consumerId 必须使用该 actionId。正式公开 skill 无 actionId 时，仅在 collectSkills、parseSkillCosts 与 prototype scan 完整且能构造稳定 declaration fingerprint 时允许使用 fingerprint；fingerprint 只包含 actionKind、规范化资源成本、prototypeKind 集合、target mode、承载方式机械码，不得包含技能名、角色名、描述文本；fingerprint 只能作为 actionId/consumerId，不得进入 sourceFactIds/sourceEventIds。无法构造 fingerprint 时 action catalog 必须为 PARTIAL。followUpKeys 是当前公开 consumer 可承接的 FOLLOW_UP key 集合。",
    "sourceClosure": "Source production entry 只接受当前加载的正式 Decision/Preview/PDA API 对象 identity；任意替换、proxy 或 test-double API 必须拒绝。Source 必须先验证该信任边界内 PDA、Preview、public snapshot、action index 的所有 fact/event ID，再生成 factIds、eventIds、closureHash；requestHash、opportunityId、visibleWorldRevision、scheduleRevision，以及 sourceEffectId、semanticKey、effectInstanceId、rootCauseId、声明 actionId、真实 grant entryId 可直接作为实际事务/快照 fact/event refs；公开 action/skill 的 catalog evidence 必须绑定实际 requestHash、visibleWorldRevision 与真实 collectSkills/parseSkillCosts/prototype scan 边界；declaration fingerprint 不是 fact/event ref，禁止写入 sourceFactIds/sourceEventIds；FOLLOW_UP grantProofIds 只接受正式 PDA/Preview authenticated grant row/event 的真实 entryId，必须先在该 grant own refs 中闭合，再由 Compiler 验证 proof 在 sourceClosure 中存在；不要求 proof 属于 consumer，禁止先写当前 row 再反查自身。prepare 先将 normalized request 作为唯一 baseline 边界：原始状态效果或持续效果字段为 undefined/缺失时补为 {}，原始 evaluationContext.scheduledEvents 为 undefined/缺失时补为 []；状态效果/持续效果若为 null、数组或非 plain object，或 scheduledEvents 若为 null、非数组，必须 Fatal。baseline completeness 只评估该 normalized request，不回看 raw input。TEAM baseline 的完整边界严格是 normalized request 中当前 visibleWorld 全部可见 unit 的显式状态效果容器与持续效果容器、当前 evaluationContext.scheduledEvents，以及对应 visibleWorldRevision/scheduleRevision；全部容器显式为空、scheduledEvents 为 [] 且 revision 闭合时 TEAM baseline 可为 COMPLETE；任一 normalized 非空项无法 typed 映射，必须为 PARTIAL。unknown prototype 或 prototype/grant scan 不完整均使 action catalog/FOLLOW_UP 轴为 PARTIAL；显式 followUpKeys=[] 不能覆盖该结论。当前没有独立正式 committed effects 字段，committed 不构成完成前提；不得读取或要求 teamMarginalPlan。closureHash 是事务内稳定 identity，不冒充证据 SHA256。",
    "registryAttestation": "registryAttestation 证明 Source 内嵌的固定 BehaviorRelationalProjectorRegistryV1 完整 27 项 mapping；PDA runtime registry 只验证 prototype key 覆盖，不承载 mapping 字段，因此不得要求 PDA 每 row 提供 mapping。正式 harness 必须逐项比较 Source 内嵌 mapping 与 JSON registry；Compiler 只接受本固定 attestation，不读取 registry entry。projectorIds 是固定 opaque ID 覆盖数组，不表达 kind 映射。"
  },
  "formulaRules": {
    "teamEffect": "R 是 candidate TEAM_EFFECT identity 集合，B 是 baseline TEAM_EFFECT identity 集合；MARGINAL_GAIN=|R minus B|/|R|，REDUNDANCY_RATIO=|R intersection B|/|R|。",
    "resourceDeficit": "对每个 publicConsumer 派生 max(0,requiredAmount-currentAmount)，按 ownerId/resourceKey 汇总；不生成 RESOURCE_DEFICIT entry。",
    "resourceCoverage": "按 targetId===publicConsumer.ownerId 且 resourceKey 相同汇总 NOW supply；RESOURCE_DEFICIT_COVERAGE=sum(min(supply,deficit))/sum(deficit)。candidate 有 supply 但当前公开 deficit 总额为 0 时为 NOT_APPLICABLE/NO_RESOURCE_DEFICIT。",
    "consumerFit": "对每个 targetId===publicConsumer.ownerId 且 resourceKey 相同的公开 consumer，若 currentAmount<requiredAmount 且 currentAmount+NOW supplyAmount>=requiredAmount，则计为 newly payable；RESOURCE_CONSUMER_FIT=newly payable consumer 数/同资源轴公开 consumer 数。存在 consumer 且均已可支付时为 KNOWN 0；consumer 为空时为 NOT_APPLICABLE/NO_RESOURCE_CONSUMER。",
    "followUp": "TEAM_FOLLOWUP_COVERAGE=grantProofIds 中每个真实 grant entryId 均在 grant own refs 与 sourceClosure 中闭合，且 grant.ownerId===publicConsumer.ownerId、followUpKey 命中至少一个当前公开 consumer.followUpKeys 的 candidate grant 数/candidate grant 总数；proof 不参与 consumer 身份证明；无 consumer 时为 KNOWN 0，grant 总数为 0 时为 NOT_APPLICABLE/NO_FOLLOW_UP_GRANT。",
    "partialAndEmpty": "相关轴 PARTIAL 时只能 UNKNOWN；UNKNOWN reasonCode 为 AXIS_PARTIAL 或 ACTION_CATALOG_PARTIAL。COMPLETE 空轴才允许 NOT_APPLICABLE。",
    "numeric": "五项 value 均为 0..1；不使用概率、expectedDelta、teacher value、score、valueVector 或中文理由。"
  },
  "outputShape": {